{
  "$schema": "https://json-schema.org/draft/2020-12/schema",
  "title": "Nerd Research DAG",
  "description": "Schema for the nerd research knowledge graph. Per-project files store theories, verdicts, build infrastructure profiles (build_profile, cache_verdict), rubric instruments (rubric, triangle_verdict), and edges. The global index stores synthesis nodes and tool_availability nodes. Infra nodes use I-prefixed IDs; rubric nodes use R-prefixed IDs; triangle-verdict (judge-calibration) nodes use TRI-prefixed IDs. Most node types use status active|stale; rubric_node uses active|deprecated (deprecated = superseded by a forked rubric_id), so a generic consumer enumerating aged-out nodes by status:stale should also account for deprecated rubric nodes.",

  "definitions": {
    "theory_node": {
      "type": "object",
      "description": "A competing hypothesis about why a system behaves a certain way.",
      "required": ["id", "type", "title", "source_experiment", "source_files", "codebase_hash", "created_at", "status", "tags"],
      "properties": {
        "id": { "type": "string", "pattern": "^T\\d{3,}$", "description": "Theory ID, e.g. T001" },
        "type": { "const": "theory" },
        "title": { "type": "string", "description": "Human-readable theory statement" },
        "source_experiment": { "type": "string", "description": "Experiment ID that generated this theory, e.g. E001" },
        "source_files": {
          "type": "array",
          "items": { "type": "string" },
          "description": "File paths this theory is about"
        },
        "codebase_hash": { "type": "string", "pattern": "^[a-f0-9]{8}$", "description": "8-char SHA hash of sorted source file contents at time of creation" },
        "created_at": { "type": "string", "format": "date-time" },
        "status": { "enum": ["active", "stale"], "description": "Active = current, stale = source files changed since creation" },
        "tags": {
          "type": "array",
          "items": { "type": "string" },
          "description": "Category tags for matching and synthesis clustering"
        },
        "spawned_from": { "type": ["string", "null"], "description": "Verdict ID that spawned this theory, if any" },
        "research_type": { "type": "string", "enum": ["parameter", "performance", "experiment", "hypothesis"], "description": "Distinguishes research types. 'parameter' = tunable-value sweep; 'performance' = perf benchmark (theories go stale faster — codebase_hash should be scoped to profiled functions, not whole codebase); 'experiment' = any other falsifiable experiment with a numeric metric (model/prompt comparison, ablation) fitting neither category; 'hypothesis' = a single-commit / single-change sweep-of-one test (the /nerd-this brief mode). Optional — nodes may omit it." }
      }
    },

    "verdict_node": {
      "type": "object",
      "description": "The outcome of testing a theory via experiment.",
      "required": ["id", "type", "theory_id", "result", "evidence", "recommendation", "source_experiment", "source_files", "codebase_hash", "created_at", "status"],
      "properties": {
        "id": { "type": "string", "pattern": "^V\\d{3,}$", "description": "Verdict ID, e.g. V001" },
        "type": { "const": "verdict" },
        "theory_id": { "type": "string", "description": "ID of the theory this verdict evaluates" },
        "result": { "enum": ["SUPPORTED", "REFUTED", "INCONCLUSIVE"] },
        "evidence": { "type": "string", "description": "One-line summary of evidence" },
        "recommendation": { "enum": ["KEEP", "CHANGE", "REARCHITECT", "REMOVE", "INVESTIGATE"] },
        "source_experiment": { "type": "string", "description": "Experiment ID that produced this verdict" },
        "source_files": {
          "type": "array",
          "items": { "type": "string" }
        },
        "codebase_hash": { "type": "string", "pattern": "^[a-f0-9]{8}$" },
        "created_at": { "type": "string", "format": "date-time" },
        "status": { "enum": ["active", "stale"] },
        "rubric_id": { "type": "string", "description": "Optional — present only for rubric-judged experiments (instrument_kind: judge_rubric). Library id of the rubric this verdict was judged against, e.g. 'portrait-v3'." },
        "rubric_hash": { "type": "string", "pattern": "^[a-f0-9]{64}$", "description": "Optional — sha256 (64 hex) of the rubric YAML at judging time. Pins the verdict to exact rubric content." },
        "judge_id": { "type": "string", "description": "Optional — the judge model used, e.g. 'claude-opus-4-7'." },
        "triangle_verdict_id": { "type": "string", "pattern": "^TRI\\d{3,}$", "description": "Optional — the triangle_verdict node that admitted this judge instrument." },
        "criterion_scores": {
          "type": "object",
          "description": "Optional — per-criterion scores from the rubric. Keys are criterion names; values are numeric scores (e.g. Likert means) or booleans (e.g. pass/fail flags like face_drift).",
          "additionalProperties": { "type": ["number", "boolean"] }
        }
      },
      "allOf": [
        {
          "$comment": "Rubric-judged verdicts must carry full provenance. If rubric_id is present, the rest of the rubric fields become required — this catches a partially-written rubric verdict at validation time. Numeric verdicts (no rubric_id) are unaffected.",
          "if": { "required": ["rubric_id"] },
          "then": { "required": ["rubric_hash", "judge_id", "triangle_verdict_id", "criterion_scores"] }
        }
      ]
    },

    "build_profile_node": {
      "type": "object",
      "description": "Build infrastructure profile for a project — dependency count, build times, artifact sizes. Created by lab-tech Check 7. Language-agnostic.",
      "required": ["id", "type", "title", "data", "source_files", "codebase_hash", "created_at", "status"],
      "properties": {
        "id": { "type": "string", "pattern": "^I\\d{3,}$", "description": "Infra node ID, e.g. I001" },
        "type": { "const": "build_profile" },
        "title": { "type": "string", "description": "Human-readable profile summary" },
        "data": {
          "type": "object",
          "required": ["language", "build_time_cold_seconds", "build_time_incremental_seconds"],
          "properties": {
            "language": { "type": "string" },
            "dependency_count": { "type": "integer" },
            "build_time_cold_seconds": { "type": "number" },
            "build_time_incremental_seconds": { "type": "number" },
            "artifact_size_mb": { "type": "number" },
            "measured_at": { "type": "string", "format": "date-time" }
          }
        },
        "source_files": {
          "type": "array",
          "items": { "type": "string" },
          "description": "Files that affect build profile, e.g. Cargo.toml, Cargo.lock"
        },
        "codebase_hash": { "type": "string", "pattern": "^[a-f0-9]{8}$" },
        "created_at": { "type": "string", "format": "date-time" },
        "status": { "enum": ["active", "stale"] }
      }
    },

    "cache_verdict_node": {
      "type": "object",
      "description": "Success/failure record for a build cache strategy. Written by report-compiler after experiment batches.",
      "required": ["id", "type", "title", "strategy", "result", "evidence", "created_at", "status"],
      "properties": {
        "id": { "type": "string", "pattern": "^I\\d{3,}$", "description": "Infra node ID, e.g. I002" },
        "type": { "const": "cache_verdict" },
        "title": { "type": "string" },
        "strategy": { "type": "string", "description": "The cache strategy that was tested (e.g., sccache, ccache, artifact_copy, incremental, none)" },
        "result": { "enum": ["SUCCESS", "FAILED"] },
        "evidence": { "type": "string", "description": "One-line evidence summary" },
        "runs_tested": { "type": "integer", "description": "Number of batch runs this verdict covers" },
        "failure_count": { "type": "integer", "description": "Number of CACHE_FALLBACK events if FAILED" },
        "created_at": { "type": "string", "format": "date-time" },
        "status": { "enum": ["active", "stale"] }
      }
    },

    "tool_availability_node": {
      "type": "object",
      "description": "Record of a build cache tool detected on this machine. Global scope (project: null in the global index).",
      "required": ["id", "type", "title", "data", "status"],
      "properties": {
        "id": { "type": "string", "pattern": "^I\\d{3,}$", "description": "Infra node ID, e.g. I003" },
        "type": { "const": "tool_availability" },
        "title": { "type": "string" },
        "data": {
          "type": "object",
          "required": ["tool", "detected_at"],
          "properties": {
            "tool": { "type": "string", "description": "Tool name, e.g. sccache" },
            "version": { "type": "string" },
            "path": { "type": "string", "description": "Absolute path to the tool binary" },
            "detected_at": { "type": "string", "format": "date-time" }
          }
        },
        "status": { "enum": ["active", "stale"] }
      }
    },

    "synthesis_node": {
      "type": "object",
      "description": "A pattern observed across 3+ verdicts, potentially cross-project. Stored in index.json.",
      "required": ["id", "type", "title", "claim", "supporting_verdicts", "confidence", "created_at", "status"],
      "properties": {
        "id": { "type": "string", "pattern": "^S\\d{3,}$", "description": "Synthesis ID, e.g. S001" },
        "type": { "const": "synthesis" },
        "project": { "type": ["string", "null"], "description": "null for cross-project synthesis" },
        "title": { "type": "string" },
        "claim": { "type": "string", "description": "Specific claim with evidence count" },
        "supporting_verdicts": {
          "type": "array",
          "minItems": 3,
          "items": {
            "type": "object",
            "required": ["project", "id"],
            "properties": {
              "project": { "type": "string", "description": "Project slug of the verdict" },
              "id": { "type": "string", "description": "Verdict ID in that project" }
            }
          },
          "description": "Qualified references to verdicts supporting this synthesis"
        },
        "confidence": { "enum": ["high", "medium", "low"] },
        "created_at": { "type": "string", "format": "date-time" },
        "status": { "enum": ["active", "stale"] }
      }
    },

    "rubric_node": {
      "type": "object",
      "description": "A reference to a pre-registered rubric used as a judging instrument. The authoritative rubric content lives in the YAML library file (.nerd/rubrics/<id>.yaml); this node references it by content hash so any criteria change forces a new hash (and, per strict pre-registration, a fork to a new rubric_id). Written by report-compiler.",
      "required": ["id", "type", "rubric_library_id", "version", "content_hash", "source_path", "created_at", "status"],
      "properties": {
        "id": { "type": "string", "pattern": "^R\\d{3,}$", "description": "Rubric node ID, e.g. R001" },
        "type": { "const": "rubric" },
        "rubric_library_id": { "type": "string", "description": "Library id — the YAML file basename without extension, e.g. 'portrait-v3'" },
        "version": { "type": "integer", "description": "Informational version metadata from the rubric YAML. Not a migration mechanism — substantive change forks to a new rubric_id." },
        "content_hash": { "type": "string", "pattern": "^[a-f0-9]{64}$", "description": "sha256 (64 hex) of the canonicalized rubric YAML. The cryptographic pin for strict pre-registration." },
        "source_path": { "type": "string", "description": "Repo-relative path to the rubric YAML, e.g. .nerd/rubrics/portrait-v3.yaml" },
        "created_at": { "type": "string", "format": "date-time" },
        "created_by": { "type": "string", "description": "Optional — author of the rubric at first registration." },
        "status": { "enum": ["active", "deprecated"], "description": "active = current; deprecated = superseded by a forked rubric_id" }
      }
    },

    "triangle_verdict_node": {
      "type": "object",
      "description": "A cached judge-instrument calibration verdict: whether a given judge can discriminate a rubric's stimuli in a blind triangle test. Cached per (rubric_hash, judge_id) and reused within the rubric's freshness window. Structural twin of cache_verdict_node — result carries the PASS/FAIL outcome, status carries the active/stale lifecycle. Written by report-compiler from lab-tech's readiness report.",
      "required": ["id", "type", "rubric_hash", "judge_id", "correct_count", "total_trials", "result", "verified_at", "status"],
      "properties": {
        "id": { "type": "string", "pattern": "^TRI\\d{3,}$", "description": "Triangle verdict node ID, e.g. TRI001" },
        "type": { "const": "triangle_verdict" },
        "rubric_hash": { "type": "string", "pattern": "^[a-f0-9]{64}$", "description": "sha256 (64 hex) of the rubric YAML at verdict time — pins the verdict to specific rubric content." },
        "judge_id": { "type": "string", "description": "Judge model used, e.g. 'claude-opus-4-7'" },
        "correct_count": { "type": "integer", "minimum": 0, "description": "Trials where the judge correctly identified the odd-one-out. Must be <= total_trials (enforced as a runtime assertion by report-compiler before writing — JSON Schema cross-field comparison is not used in this schema)." },
        "total_trials": { "type": "integer", "minimum": 1, "description": "Total triangle trials run." },
        "result": { "enum": ["PASS", "FAIL"], "description": "PASS = judge discriminates the rubric's stimuli above chance (binomial p<0.05); FAIL = cannot discriminate." },
        "verified_at": { "type": "string", "format": "date-time", "description": "When this calibration was run. Freshness is computed against the rubric's triangle_cache_days at read time." },
        "status": { "enum": ["active", "stale"] },
        "notes": { "type": "string", "description": "Optional free-text note." }
      }
    },

    "edge": {
      "type": "object",
      "description": "A relationship between two nodes with explanatory context.",
      "required": ["from", "to", "type"],
      "properties": {
        "from": { "type": "string", "description": "Source node ID" },
        "to": { "type": "string", "description": "Target node ID" },
        "type": { "enum": ["supports", "refutes", "spawned"] },
        "reason": { "type": "string", "description": "Why this relationship exists" }
      }
    }
  },

  "type": "object",
  "description": "A DAG file — either a per-project file or the global index.",
  "required": ["nodes", "edges", "version"],
  "properties": {
    "nodes": {
      "type": "array",
      "items": {
        "oneOf": [
          { "$ref": "#/definitions/theory_node" },
          { "$ref": "#/definitions/verdict_node" },
          { "$ref": "#/definitions/synthesis_node" },
          { "$ref": "#/definitions/build_profile_node" },
          { "$ref": "#/definitions/cache_verdict_node" },
          { "$ref": "#/definitions/tool_availability_node" },
          { "$ref": "#/definitions/rubric_node" },
          { "$ref": "#/definitions/triangle_verdict_node" }
        ]
      }
    },
    "edges": {
      "type": "array",
      "items": { "$ref": "#/definitions/edge" },
      "description": "Relationships between nodes. Present in project files, optional in index."
    },
    "project": { "type": "string", "description": "Project slug (per-project files only)" },
    "project_path": { "type": "string", "description": "Absolute path to project root, for collision detection" },
    "version": { "type": "integer", "minimum": 1, "description": "Schema version for future migration" }
  }
}
