{
  "nodes": [
    {
      "id": "R001",
      "type": "rubric",
      "rubric_library_id": "portrait-v3",
      "version": 3,
      "content_hash": "9f2c4a7b1e8d3056c4f9a2b7e0d1c8a35f6b9e2d4c7a0b3e6d9f2c5a8b1e4d70",
      "source_path": ".nerd/rubrics/portrait-v3.yaml",
      "created_at": "2026-06-20T09:00:00Z",
      "created_by": "shawn",
      "status": "active"
    },
    {
      "id": "TRI001",
      "type": "triangle_verdict",
      "rubric_hash": "9f2c4a7b1e8d3056c4f9a2b7e0d1c8a35f6b9e2d4c7a0b3e6d9f2c5a8b1e4d70",
      "judge_id": "claude-opus-4-7",
      "correct_count": 13,
      "total_trials": 15,
      "result": "PASS",
      "verified_at": "2026-06-20T09:05:00Z",
      "status": "active",
      "notes": "Blind 3-item triangle on subject_identity; 1/3 null."
    },
    {
      "id": "T042",
      "type": "theory",
      "title": "The new portrait pipeline preserves subject identity better than the baseline",
      "source_experiment": "E-PORTRAIT-IDENTITY",
      "source_files": ["pipelines/portrait/render.ext"],
      "codebase_hash": "a1b2c3d4",
      "created_at": "2026-06-23T10:00:00Z",
      "status": "active",
      "research_type": "experiment",
      "tags": ["portrait", "identity-preservation"]
    },
    {
      "id": "V042",
      "type": "verdict",
      "theory_id": "T042",
      "result": "SUPPORTED",
      "evidence": "Judge scored subject_identity mean 4.93 across the cell grid; no cell flagged face_drift.",
      "recommendation": "KEEP",
      "source_experiment": "E-PORTRAIT-IDENTITY",
      "source_files": ["pipelines/portrait/render.ext"],
      "codebase_hash": "a1b2c3d4",
      "created_at": "2026-06-23T10:00:00Z",
      "status": "active",
      "rubric_id": "portrait-v3",
      "rubric_hash": "9f2c4a7b1e8d3056c4f9a2b7e0d1c8a35f6b9e2d4c7a0b3e6d9f2c5a8b1e4d70",
      "judge_id": "claude-opus-4-7",
      "triangle_verdict_id": "TRI001",
      "criterion_scores": { "subject_identity": 4.93, "composition": 5.0, "vibe": 5.0, "face_drift": false }
    }
  ],
  "edges": [
    {
      "from": "V042",
      "to": "T042",
      "type": "supports",
      "reason": "Rubric verdict SUPPORTED — judge confirmed identity preservation."
    }
  ],
  "project": "example-rubric",
  "project_path": "/example/rubric",
  "version": 1
}
